{"$schema":"https://json-schema.org/draft/2020-12/schema","$id":"https://novel-production-os.local/schemas/soft-corpus.samples.v1.schema.json","type":"object","additionalProperties":false,"required":["schema_version","corpus_id","samples","samples_hash"],"properties":{"schema_version":{"const":"soft-corpus.samples.v1"},"corpus_id":{"const":"soft-calibration-v1"},"samples":{"type":"array","minItems":90,"maxItems":90,"items":{"type":"object","additionalProperties":false,"required":["sample_id","detector_id","prose","prose_hash","context","sample_hash"],"properties":{"sample_id":{"type":"string"},"detector_id":{"enum":["persona_drift","trope_repeat","word_count_cheat"]},"prose":{"type":"string"},"prose_hash":{"$ref":"#/$defs/hash"},"context":{"oneOf":[{"type":"object","additionalProperties":false,"required":["persona_baseline"],"properties":{"persona_baseline":{"type":"string"}}},{"type":"object","additionalProperties":false,"maxProperties":0},{"type":"object","additionalProperties":false,"required":["filler_tokens"],"properties":{"filler_tokens":{"const":["\u5176\u5b9e","\u7136\u540e","\u4e8e\u662f"]}}}]},"sample_hash":{"$ref":"#/$defs/hash"}}}},"samples_hash":{"$ref":"#/$defs/hash"}},"$defs":{"hash":{"type":"string","pattern":"^sha256:[0-9a-f]{64}$"}}}