{"corpus_id":"soft-calibration-v1","samples":[{"context":{"persona_baseline":"persona_baseline_01"},"detector_id":"persona_drift","prose":"角色在第1个受控场景中行动。<!-- novel:persona {\"value\":\"persona_drift_01\"} -->","prose_hash":"sha256:c463076ab4ef1cef8cff089d00eed3f2a0ead8067e596729b81fd0940a63b5d4","sample_hash":"sha256:2156552bed59e997b128714b0ab64425f96b51366927a200dbae0faf92929909","sample_id":"soft_persona_drift_01"},{"context":{"persona_baseline":"persona_baseline_02"},"detector_id":"persona_drift","prose":"角色在第2个受控场景中行动。<!-- novel:persona {\"value\":\"persona_drift_02\"} -->","prose_hash":"sha256:b281406443ad2a671bbb7495796f3fe5b27dc3e2638bfd26e819a474dc697007","sample_hash":"sha256:d269fd02e0dd1a4f7f1f9c5de2390f96f486a782b627c79ce8fa9ca275822be2","sample_id":"soft_persona_drift_02"},{"context":{"persona_baseline":"persona_baseline_03"},"detector_id":"persona_drift","prose":"角色在第3个受控场景中行动。<!-- novel:persona {\"value\":\"persona_drift_03\"} -->","prose_hash":"sha256:227e970310fd7674af129fe7f085b5e6b7dee28b91276b476e5c89949163ae7b","sample_hash":"sha256:f053d3185bb7b1128c4136bc10497e57419636f501fb412b1c31634078f89291","sample_id":"soft_persona_drift_03"},{"context":{"persona_baseline":"persona_baseline_04"},"detector_id":"persona_drift","prose":"角色在第4个受控场景中行动。<!-- novel:persona {\"value\":\"persona_drift_04\"} -->","prose_hash":"sha256:6af2724bd9532c9ed4ffa6790f9f755fb998780da1ae612c92c62e68a31b25f1","sample_hash":"sha256:e30e8818a1a7f895fc4604a4d408041f3b1376462f1de981a9031c80a53215ae","sample_id":"soft_persona_drift_04"},{"context":{"persona_baseline":"persona_baseline_05"},"detector_id":"persona_drift","prose":"角色在第5个受控场景中行动。<!-- novel:persona {\"value\":\"persona_drift_05\"} -->","prose_hash":"sha256:e03f620738066871c9510ca1e36426a575e6ae1e47909e6ea283af7c2b8b39a1","sample_hash":"sha256:73c2fe4e82668bacc0252cb5719e22ce643ebf8d2e175d999990bd60de50cd5d","sample_id":"soft_persona_drift_05"},{"context":{"persona_baseline":"persona_baseline_06"},"detector_id":"persona_drift","prose":"角色在第6个受控场景中行动。<!-- novel:persona {\"value\":\"persona_drift_06\"} -->","prose_hash":"sha256:028d040b8026719d12502ee6133649a4ef4f98e7cea2cca73cc6f2d46cd16915","sample_hash":"sha256:3c4c0125e3dceac3669e2a4f34634b4e6765f4d2dc8c08a4885e05df61975655","sample_id":"soft_persona_drift_06"},{"context":{"persona_baseline":"persona_baseline_07"},"detector_id":"persona_drift","prose":"角色在第7个受控场景中行动。<!-- novel:persona {\"value\":\"persona_baseline_07\"} -->","prose_hash":"sha256:dbeb04b6501d7ca092e9ba43bdc3e6dae21b4f7d203460e32f8db7097defacf6","sample_hash":"sha256:bc20833ae0892b59d631517b2c5cf28dbad803fa4558d0f65eba529b5baf33ef","sample_id":"soft_persona_drift_07"},{"context":{"persona_baseline":"persona_baseline_08"},"detector_id":"persona_drift","prose":"角色在第8个受控场景中行动。<!-- novel:persona {\"value\":\"persona_baseline_08\"} -->","prose_hash":"sha256:3be42ccbdefafc5d4954efb916e77d5290f77c4a01470276c12ed6530fef5c0a","sample_hash":"sha256:0a4f3fd6661b9bea917915c80bbbbd918d7cfb6a7d098793b42f5e5ac1d93b88","sample_id":"soft_persona_drift_08"},{"context":{"persona_baseline":"persona_baseline_09"},"detector_id":"persona_drift","prose":"角色在第9个受控场景中行动。<!-- novel:persona {\"value\":\"persona_baseline_09\"} -->","prose_hash":"sha256:94469709361fc23c4e6e777eeb9b13ec026cc89e896ecdfd11d03d9333d0439f","sample_hash":"sha256:2a83a92e94c041847901c9dc26c3cfed3185397c245fb7d5f28c39820573dc13","sample_id":"soft_persona_drift_09"},{"context":{"persona_baseline":"persona_baseline_10"},"detector_id":"persona_drift","prose":"角色在第10个受控场景中行动。<!-- novel:persona {\"value\":\"persona_baseline_10\"} -->","prose_hash":"sha256:d91197491632016d70fee45e70ec762f1a0f86eeb10150246e66bde6ac55880f","sample_hash":"sha256:c4c985807c7f0ccd8c6ded4b315d458488b431ebe01b17c001c499ec8dd822aa","sample_id":"soft_persona_drift_10"},{"context":{"persona_baseline":"persona_baseline_11"},"detector_id":"persona_drift","prose":"角色在第11个受控场景中行动。<!-- novel:persona {\"value\":\"persona_baseline_11\"} -->","prose_hash":"sha256:5f4d338fbb584545e22f842c4f22dec01754d4b1da22d2a0e906a75cc3ba7d99","sample_hash":"sha256:d6bb7f6137b0f3e98c873c3b4391d68e0e43476ab5bbaa9e41f9524bf8af90e3","sample_id":"soft_persona_drift_11"},{"context":{"persona_baseline":"persona_baseline_12"},"detector_id":"persona_drift","prose":"角色在第12个受控场景中行动。<!-- novel:persona {\"value\":\"persona_baseline_12\"} -->","prose_hash":"sha256:14049416f2bffacbd03bec6c2fb52175dad8d02d8d49d2dc9b8cdba070973a41","sample_hash":"sha256:a55721bdaf28311c2c37e218a5ad55ddda03427733761ca37fe5347082603998","sample_id":"soft_persona_drift_12"},{"context":{"persona_baseline":"persona_baseline_13"},"detector_id":"persona_drift","prose":"角色在第13个受控场景中行动。<!-- novel:persona {\"value\":\"persona_drift_13\"} -->","prose_hash":"sha256:1ad9b995cbaeb87f7522627c4727073628c0234d28d2bf6aa83995c664849d2e","sample_hash":"sha256:74d5e7b7a06964ee1e89f8d616a5b749ac8e582a302e88b288cedf5d38e352e0","sample_id":"soft_persona_drift_13"},{"context":{"persona_baseline":"persona_baseline_14"},"detector_id":"persona_drift","prose":"角色在第14个受控场景中行动。<!-- novel:persona {\"value\":\"persona_drift_14\"} -->","prose_hash":"sha256:5dcd4042e9166ffa8d5d5c1b8edae83479867add1e237bc5261340b44309ede0","sample_hash":"sha256:0fa541fcc8d0edcc9adf7a968fe00cf140e993134a3032d27c85ddd6809af8b1","sample_id":"soft_persona_drift_14"},{"context":{"persona_baseline":"persona_baseline_15"},"detector_id":"persona_drift","prose":"角色在第15个受控场景中行动。<!-- novel:persona {\"value\":\"persona_drift_15\"} -->","prose_hash":"sha256:2880f69e8b2465eed4f9b8a7625621b2d7101e9476cfb13a99f74c041447f959","sample_hash":"sha256:49e011ed2c8a1c63092630ef31cdaad90347dd4e9b86ed191140d8e2370bcaee","sample_id":"soft_persona_drift_15"},{"context":{"persona_baseline":"persona_baseline_16"},"detector_id":"persona_drift","prose":"角色在第16个受控场景中行动。<!-- novel:persona {\"value\":\"persona_drift_16\"} -->","prose_hash":"sha256:238251645740c7e4f200211ba060cdb23ad9115a71a007d80a27bcddcb382076","sample_hash":"sha256:c26dd82888d16098dc3cc2fd99f5e879a54e8115a9e01ef5ba7e568b95c3052f","sample_id":"soft_persona_drift_16"},{"context":{"persona_baseline":"persona_baseline_17"},"detector_id":"persona_drift","prose":"角色在第17个受控场景中行动。<!-- novel:persona {\"value\":\"persona_drift_17\"} -->","prose_hash":"sha256:0fd39da709bcc38d680b08d9efcddbbca21b9bc9c8e170d0fefee06ee9c2eb80","sample_hash":"sha256:8da511c967d6004c0ebc486ae802c33890617d72090c945f96f0d863669e167c","sample_id":"soft_persona_drift_17"},{"context":{"persona_baseline":"persona_baseline_18"},"detector_id":"persona_drift","prose":"角色在第18个受控场景中行动。<!-- novel:persona {\"value\":\"persona_baseline_18\"} -->","prose_hash":"sha256:864ba5072a0e05d471306ca9f60a98486af276fd5a9adfb772556add275a22a3","sample_hash":"sha256:edc43bb03dc3d037123c858f7d8e588313ade2e7e58652c5c041a423db0e4d23","sample_id":"soft_persona_drift_18"},{"context":{"persona_baseline":"persona_baseline_19"},"detector_id":"persona_drift","prose":"角色在第19个受控场景中行动。<!-- novel:persona {\"value\":\"persona_baseline_19\"} -->","prose_hash":"sha256:c9755a39bff2e8cfc79155d4b4bd869d095b5f240b92bfde9aa97991fef1249d","sample_hash":"sha256:dbb599d90b609c1b666c356f0e04f32268356cdbe9b3250bae265cc1190d0560","sample_id":"soft_persona_drift_19"},{"context":{"persona_baseline":"persona_baseline_20"},"detector_id":"persona_drift","prose":"角色在第20个受控场景中行动。<!-- novel:persona {\"value\":\"persona_baseline_20\"} -->","prose_hash":"sha256:f7cd052770bd8cc29abce435220750b66be8264a6eff5d442a4d33965b8f416e","sample_hash":"sha256:b3d8029b3fe360cc580c51d6ffde908155691bac9483dc2b7e93c6ab64c65f37","sample_id":"soft_persona_drift_20"},{"context":{"persona_baseline":"persona_baseline_21"},"detector_id":"persona_drift","prose":"角色在第21个受控场景中行动。<!-- novel:persona {\"value\":\"persona_baseline_21\"} -->","prose_hash":"sha256:98dc2ee22361efb0674574fed4a42d48924c31d0793313e6db64cb3e87c6edfd","sample_hash":"sha256:b052b2ec2335dab7b6dbe98c9e4df6a678ffe5137a71656123be4949720003f9","sample_id":"soft_persona_drift_21"},{"context":{"persona_baseline":"persona_baseline_22"},"detector_id":"persona_drift","prose":"角色在第22个受控场景中行动。<!-- novel:persona {\"value\":\"persona_baseline_22\"} -->","prose_hash":"sha256:806c01da8ea38aa31b77e5071d5c4d7d833e0506705c7cd4397f585f7847b64b","sample_hash":"sha256:e7040fddbc017ac6a93fcec1c7c9c83783972c2f131c5b7b2a1bc57519e5bf09","sample_id":"soft_persona_drift_22"},{"context":{"persona_baseline":"persona_baseline_23"},"detector_id":"persona_drift","prose":"角色在第23个受控场景中行动。<!-- novel:persona {\"value\":\"persona_drift_23\"} -->","prose_hash":"sha256:3285bc1113626b753e776492653019697b3c5571857e2b4e89364e61b90b8bd1","sample_hash":"sha256:d62074aac5055439cfa37846478ddbcb97bba5ced7a1f52c8d93764effd5cbb6","sample_id":"soft_persona_drift_23"},{"context":{"persona_baseline":"persona_baseline_24"},"detector_id":"persona_drift","prose":"角色在第24个受控场景中行动。<!-- novel:persona {\"value\":\"persona_drift_24\"} -->","prose_hash":"sha256:5a710bab476faf87327421d6863eb458fb81a857f32beea36c4dbf792d32e15c","sample_hash":"sha256:6a3968cc65c1128647fecfc48519a89711d167d08d0cb6b313f668e7c54bd083","sample_id":"soft_persona_drift_24"},{"context":{"persona_baseline":"persona_baseline_25"},"detector_id":"persona_drift","prose":"角色在第25个受控场景中行动。<!-- novel:persona {\"value\":\"persona_drift_25\"} -->","prose_hash":"sha256:23a2931f17e049dd076e6e11d3249bfe2ed3864561ada35b29e4436d4fe861fc","sample_hash":"sha256:3ed63cacd6d21732ef9dbdcad16a19a7099c4e2578c345220a7d0a2cabbfbe44","sample_id":"soft_persona_drift_25"},{"context":{"persona_baseline":"persona_baseline_26"},"detector_id":"persona_drift","prose":"角色在第26个受控场景中行动。<!-- novel:persona {\"value\":\"persona_drift_26\"} -->","prose_hash":"sha256:de45e7bba29b4b1482ce34c5b1915fd9ab304e5f677dbcc27f29db98d40e5233","sample_hash":"sha256:545329263838adf37c81b871ff81a347efe201ace2543374691fdd0e9af0d79f","sample_id":"soft_persona_drift_26"},{"context":{"persona_baseline":"persona_baseline_27"},"detector_id":"persona_drift","prose":"角色在第27个受控场景中行动。<!-- novel:persona {